{
  "paper": {
    "paper_id": "CBM0032",
    "pdf_filename": "10.1016_j.conbuildmat.2010.03.009.pdf",
    "doi": "10.1016/j.conbuildmat.2010.03.009",
    "title": "Pullout behavior of inclined steel fiber in an ultra-high strength cementitious matrix",
    "authors": "Yun Lee; Su-Tae Kang; Jin-Keun Kim",
    "year": 2010,
    "journal": "Construction and Building Materials",
    "pages": "",
    "material_system": "fiber pullout in ultra-high-strength cementitious matrix",
    "annotation_status": "no_extractable_compressive_strength",
    "notes": "Pullout/bond paper provides matrix proportions but no compressive-strength result for the matrix in the packet."
  },
  "mixture_components": [],
  "strength_results": [],
  "conditions": [],
  "figures": [],
  "evidence": [
    {
      "evidence_id": "CBM0032_E001",
      "paper_id": "CBM0032",
      "source_modality": "text",
      "page": 1,
      "source_location": "page 1 title/abstract",
      "evidence_text": "Pullout/bond paper provides matrix proportions but no compressive-strength result for the matrix in the packet.",
      "supports": "scope decision",
      "confidence": 0.88,
      "human_decision": "",
      "notes": ""
    }
  ],
  "review_queue": [],
  "quality": {
    "overall_confidence": 0.88,
    "direct_insert_count": 0,
    "review_count": 0,
    "needs_human_review": false,
    "main_risks": []
  }
}