{
  "paper": {
    "paper_id": "CBM0130",
    "pdf_filename": "10.1016_j.conbuildmat.2011.04.027.pdf",
    "doi": "10.1016/j.conbuildmat.2011.04.027",
    "title": "Limiting properties in the characterisation of mixed recycled aggregates for use in the manufacture of concrete",
    "authors": "F. Agrela; M. Sanchez de Juan; J. Ayuso; V.L. Geraldes; J.R. Jimenez",
    "year": 2011,
    "journal": "Construction and Building Materials",
    "pages": "",
    "material_system": "mixed recycled aggregate characterization",
    "annotation_status": "excluded_no_primary_mixture_strength_data",
    "notes": ""
  },
  "mixture_components": [],
  "strength_results": [],
  "conditions": [],
  "figures": [
    {
      "figure_id": "CBM0130_F_PAGE_003",
      "paper_id": "CBM0130",
      "page": 3,
      "caption": "candidate compressive-strength figure/page",
      "figure_type": "candidate strength figure/page",
      "strength_relevance": "candidate compressive-strength data or context flagged by packet",
      "image_path": "",
      "extraction_status": "figure_digitization_required",
      "confidence": 0.62,
      "human_decision": "",
      "notes": "Packet flags this page as candidate compressive-strength figure/page; numeric values are not reliably readable from text packet."
    }
  ],
  "evidence": [
    {
      "evidence_id": "CBM0130_E001",
      "paper_id": "CBM0130",
      "source_modality": "text",
      "page": 1,
      "source_location": "selected packet text",
      "evidence_text": "Limiting properties in the characterisation of mixed recycled aggregates for use in the manufacture of concrete F. Agrela a,⇑, M. Sánchez de Juan b, J. Ayuso a, V.L. Geraldes b, J.R. Jiménez a a Construction Engineering Area, University of Córdoba, Córdoba, Spain b Lab. Estructuras y Materiales (CEDEX), Concrete Technology Department, Madrid, Spain article info Article history: Received 9 November 2010 Received in revised form 21 March 2011 Accepted 14 April 2011 Available online 17 May 2011 Keywords: Construction and demolition waste Mixed recycled aggregates Physical–chemical characterisation Recycled aggregate composition Water absorption abstract Recycling of construction and demolition ",
      "supports": "scope decision",
      "confidence": 0.84,
      "human_decision": "",
      "notes": ""
    }
  ],
  "review_queue": [],
  "quality": {
    "overall_confidence": 0.84,
    "direct_insert_count": 0,
    "review_count": 0,
    "needs_human_review": false,
    "main_risks": []
  }
}
