{
  "paper": {
    "paper_id": "CBM0133",
    "pdf_filename": "10.1016_j.conbuildmat.2011.04.051.pdf",
    "doi": "10.1016/j.conbuildmat.2011.04.051",
    "title": "Comparative flexural behavior of Hybrid Ultra High Performance Fiber Reinforced Concrete with different macro fibers",
    "authors": "Dong Joo Kim; Seung Hun Park; Gum Sung Ryu; Kyung Taek Koh",
    "year": 2011,
    "journal": "Construction and Building Materials",
    "pages": "",
    "material_system": "hybrid ultra-high-performance fibre reinforced concrete",
    "annotation_status": "review_required_non_compressive_focus",
    "notes": ""
  },
  "mixture_components": [],
  "strength_results": [
    {
      "result_id": "CBM0133_S001",
      "paper_id": "CBM0133",
      "mixture_id": "review_mixture",
      "mixture_original_id": "",
      "property": "compressive_strength",
      "age_days": null,
      "unit": "",
      "table_value": null,
      "recommended_value": null,
      "final_value": null,
      "value_status": "review_required",
      "is_approximate": true,
      "estimated_error_mpa": null,
      "curing_condition_id": "",
      "testing_condition_id": "",
      "evidence_ids": [
        "CBM0133_E001"
      ],
      "confidence": 0.62,
      "human_decision": "",
      "notes": "Candidate cannot be inserted directly because mixture, age, unit, or numeric value is incomplete in the packet."
    }
  ],
  "conditions": [],
  "figures": [
    {
      "figure_id": "CBM0133_F_PAGE_005",
      "paper_id": "CBM0133",
      "page": 5,
      "caption": "candidate compressive-strength figure/page",
      "figure_type": "candidate strength figure/page",
      "strength_relevance": "candidate compressive-strength data or context flagged by packet",
      "image_path": "",
      "extraction_status": "figure_digitization_required",
      "confidence": 0.62,
      "human_decision": "",
      "notes": "Packet flags this page as candidate compressive-strength figure/page; numeric values are not reliably readable from text packet."
    },
    {
      "figure_id": "CBM0133_F_PAGE_006",
      "paper_id": "CBM0133",
      "page": 6,
      "caption": "candidate compressive-strength figure/page",
      "figure_type": "candidate strength figure/page",
      "strength_relevance": "candidate compressive-strength data or context flagged by packet",
      "image_path": "",
      "extraction_status": "figure_digitization_required",
      "confidence": 0.62,
      "human_decision": "",
      "notes": "Packet flags this page as candidate compressive-strength figure/page; numeric values are not reliably readable from text packet."
    },
    {
      "figure_id": "CBM0133_F_PAGE_002",
      "paper_id": "CBM0133",
      "page": 2,
      "caption": "candidate compressive-strength figure/page",
      "figure_type": "candidate strength figure/page",
      "strength_relevance": "candidate compressive-strength data or context flagged by packet",
      "image_path": "",
      "extraction_status": "figure_digitization_required",
      "confidence": 0.62,
      "human_decision": "",
      "notes": "Packet flags this page as candidate compressive-strength figure/page; numeric values are not reliably readable from text packet."
    }
  ],
  "evidence": [
    {
      "evidence_id": "CBM0133_E001",
      "paper_id": "CBM0133",
      "source_modality": "text",
      "page": 1,
      "source_location": "selected packet text/figure flag",
      "evidence_text": "Comparative ﬂexural behavior of Hybrid Ultra High Performance Fiber Reinforced Concrete with different macro ﬁbers Dong Joo Kim a,⇑, Seung Hun Park a, Gum Sung Ryu b, Kyung Taek Koh b a Department of Civil and Environmental Engineering, Sejong University, 98 Gunja-Dong, Gwangjin-Gu, Seoul 143-747, Republic of Korea b Korea Institute of Construction Technology, 2311 Daewha-Dong ilsan-Gu, Goyang-Si, Gyeonggi-Do 411-712, Republic of Korea article info Article history: Received 24 February 2011 Received in revised form 15 April 2011 Accepted 19 April 2011 Available online 23 May 2011 Keywords: Hybrid Macro ﬁber Micro ﬁber Strain capacity Deﬂection capacity Ultra High Performance Fiber Reinforced Concrete abstract The ﬂexural performance of four Hybrid (H-) Ultra High Performance Fiber Reinforced Concretes (UHPFRCs) with different macro ﬁbers was investigated according to ASTM standards C1018",
      "supports": "review candidate",
      "confidence": 0.72,
      "human_decision": "",
      "notes": ""
    }
  ],
  "review_queue": [
    {
      "review_id": "CBM0133_R001",
      "paper_id": "CBM0133",
      "target_sheet": "strength_results",
      "target_record_ids": [
        "CBM0133_S001"
      ],
      "priority": "medium",
      "question": "Packet contains compressive-strength-related text but not a directly insertable mixture-level strength table/value.",
      "suggested_action": "Inspect original PDF table/figure and digitize or verify mixture-level compressive-strength values before insertion.",
      "human_answer": "",
      "final_decision": "",
      "notes": ""
    }
  ],
  "quality": {
    "overall_confidence": 0.6,
    "direct_insert_count": 0,
    "review_count": 1,
    "needs_human_review": true,
    "main_risks": [
      "Candidate compressive-strength data are not directly machine-readable in the packet."
    ]
  }
}
