{
  "paper": {
    "paper_id": "CBM0064",
    "pdf_filename": "10.1016_j.conbuildmat.2010.07.009.pdf",
    "doi": "10.1016/j.conbuildmat.2010.07.009",
    "title": "Nanotechnology in construction and building materials",
    "authors": "",
    "year": 2011,
    "journal": "Construction and Building Materials",
    "pages": "",
    "material_system": "nanotechnology review",
    "annotation_status": "excluded_no_cement_compressive_strength",
    "notes": "Review/conclusion packet without original compressive-strength dataset."
  },
  "mixture_components": [],
  "strength_results": [],
  "conditions": [],
  "figures": [],
  "evidence": [
    {
      "evidence_id": "CBM0064_E001",
      "paper_id": "CBM0064",
      "source_modality": "text",
      "page": 1,
      "source_location": "page 1 title/abstract",
      "evidence_text": "Review/conclusion packet without original compressive-strength dataset.",
      "supports": "scope decision",
      "confidence": 0.88,
      "human_decision": "",
      "notes": ""
    }
  ],
  "review_queue": [],
  "quality": {
    "overall_confidence": 0.88,
    "direct_insert_count": 0,
    "review_count": 0,
    "needs_human_review": false,
    "main_risks": []
  }
}