{
  "paper": {
    "paper_id": "CBM0020",
    "pdf_filename": "10.1016_j.conbuildmat.2010.02.003.pdf",
    "doi": "10.1016/j.conbuildmat.2010.02.003",
    "title": "Cement-bonded composites from lignocellulosic wastes",
    "authors": "S.R. Karade",
    "year": 2010,
    "journal": "Construction and Building Materials",
    "pages": "",
    "material_system": "review of cement-bonded lignocellulosic waste composites",
    "annotation_status": "no_extractable_compressive_strength",
    "notes": "Review article; tables report literature composite strength ranges, not extractable mixture-level compressive-strength records."
  },
  "mixture_components": [],
  "strength_results": [],
  "conditions": [],
  "figures": [],
  "evidence": [
    {
      "evidence_id": "CBM0020_E001",
      "paper_id": "CBM0020",
      "source_modality": "text",
      "page": 1,
      "source_location": "page 1/title or abstract",
      "evidence_text": "Review article; tables report literature composite strength ranges, not extractable mixture-level compressive-strength records.",
      "supports": "scope exclusion",
      "confidence": 0.9,
      "human_decision": "",
      "notes": ""
    }
  ],
  "review_queue": [],
  "quality": {
    "overall_confidence": 0.9,
    "direct_insert_count": 0,
    "review_count": 0,
    "needs_human_review": false,
    "main_risks": []
  }
}
